<!ELEMENT company (nombreCompañia,empleados)>
<!ELEMENT nombreCompañia (#PCDATA)>
<!ELEMENT empleados (empleado*)>
<!ELEMENT empleado (nombre,apellidos)>
<!ELEMENT nombre (#PCDATA)>
<!ELEMENT apellidos (#PCDATA)>